[
  {
    "id": "github",
    "name": "GitHub",
    "url": "https://github.com",
    "description": "Source control, pull requests, and developer collaboration.",
    "logo": "https://www.google.com/s2/favicons?domain=github.com&sz=128",
    "section": "ENGINEERING",
    "tags": ["git", "pull-requests", "code-review"]
  },
  {
    "id": "gitlab",
    "name": "GitLab",
    "url": "https://gitlab.com",
    "description": "DevSecOps platform for repos, CI, and deployments.",
    "logo": "https://www.google.com/s2/favicons?domain=gitlab.com&sz=128",
    "section": "ENGINEERING",
    "tags": ["git", "ci-cd", "devsecops"]
  },
  {
    "id": "bitbucket",
    "name": "Bitbucket",
    "url": "https://bitbucket.org",
    "description": "Git hosting for teams using the Atlassian stack.",
    "logo": "https://www.google.com/s2/favicons?domain=bitbucket.org&sz=128",
    "section": "ENGINEERING",
    "tags": ["git", "repositories", "atlassian"]
  },
  {
    "id": "jira",
    "name": "Jira",
    "url": "https://www.atlassian.com/software/jira",
    "description": "Issue tracking, sprint planning, and delivery workflows.",
    "logo": "https://www.google.com/s2/favicons?domain=atlassian.com&sz=128",
    "section": "ENGINEERING",
    "tags": ["issues", "sprints", "agile"]
  },
  {
    "id": "linear",
    "name": "Linear",
    "url": "https://linear.app",
    "description": "Fast issue tracking for product and engineering teams.",
    "logo": "https://www.google.com/s2/favicons?domain=linear.app&sz=128",
    "section": "ENGINEERING",
    "tags": ["issues", "planning", "productivity"]
  },
  {
    "id": "postman",
    "name": "Postman",
    "url": "https://www.postman.com",
    "description": "API design, testing, collections, and collaboration.",
    "logo": "https://www.google.com/s2/favicons?domain=postman.com&sz=128",
    "section": "ENGINEERING",
    "tags": ["api", "testing", "collections"]
  },
  {
    "id": "docker-hub",
    "name": "Docker Hub",
    "url": "https://hub.docker.com",
    "description": "Container registry for images, teams, and pipelines.",
    "logo": "https://www.google.com/s2/favicons?domain=docker.com&sz=128",
    "section": "ENGINEERING",
    "tags": ["containers", "images", "registry"]
  },
  {
    "id": "circleci",
    "name": "CircleCI",
    "url": "https://circleci.com",
    "description": "Continuous integration and delivery for modern teams.",
    "logo": "https://www.google.com/s2/favicons?domain=circleci.com&sz=128",
    "section": "ENGINEERING",
    "tags": ["ci", "pipelines", "automation"]
  },
  {
    "id": "jenkins",
    "name": "Jenkins",
    "url": "https://www.jenkins.io",
    "description": "Open source automation server for builds and releases.",
    "logo": "https://www.google.com/s2/favicons?domain=jenkins.io&sz=128",
    "section": "ENGINEERING",
    "tags": ["ci", "builds", "automation"]
  },
  {
    "id": "buildkite",
    "name": "Buildkite",
    "url": "https://buildkite.com",
    "description": "CI pipelines that run on your own infrastructure.",
    "logo": "https://www.google.com/s2/favicons?domain=buildkite.com&sz=128",
    "section": "ENGINEERING",
    "tags": ["ci-cd", "agents", "pipelines"]
  },
  {
    "id": "confluence",
    "name": "Confluence",
    "url": "https://www.atlassian.com/software/confluence",
    "description": "Team documentation, runbooks, and knowledge sharing.",
    "logo": "https://www.google.com/s2/favicons?domain=atlassian.com&sz=128",
    "section": "COLLABORATION",
    "tags": ["docs", "wiki", "knowledge-base"]
  },
  {
    "id": "notion",
    "name": "Notion",
    "url": "https://www.notion.so",
    "description": "Workspace for docs, project notes, and team hubs.",
    "logo": "https://www.google.com/s2/favicons?domain=notion.so&sz=128",
    "section": "COLLABORATION",
    "tags": ["docs", "notes", "workspace"]
  },
  {
    "id": "slack",
    "name": "Slack",
    "url": "https://slack.com",
    "description": "Team messaging, channels, and operational alerts.",
    "logo": "https://www.google.com/s2/favicons?domain=slack.com&sz=128",
    "section": "COLLABORATION",
    "tags": ["chat", "alerts", "collaboration"]
  },
  {
    "id": "figma",
    "name": "Figma",
    "url": "https://www.figma.com",
    "description": "Product design, prototyping, and design systems.",
    "logo": "https://www.google.com/s2/favicons?domain=figma.com&sz=128",
    "section": "COLLABORATION",
    "tags": ["design", "ui", "prototype"]
  },
  {
    "id": "miro",
    "name": "Miro",
    "url": "https://miro.com",
    "description": "Visual collaboration for planning, mapping, and workshops.",
    "logo": "https://www.google.com/s2/favicons?domain=miro.com&sz=128",
    "section": "COLLABORATION",
    "tags": ["whiteboard", "planning", "workshops"]
  },
  {
    "id": "loom",
    "name": "Loom",
    "url": "https://www.loom.com",
    "description": "Async video messaging for demos, support, and handoffs.",
    "logo": "https://www.google.com/s2/favicons?domain=loom.com&sz=128",
    "section": "COLLABORATION",
    "tags": ["video", "async", "handoff"]
  },
  {
    "id": "asana",
    "name": "Asana",
    "url": "https://asana.com",
    "description": "Cross-functional planning and task execution at scale.",
    "logo": "https://www.google.com/s2/favicons?domain=asana.com&sz=128",
    "section": "COLLABORATION",
    "tags": ["tasks", "planning", "operations"]
  },
  {
    "id": "trello",
    "name": "Trello",
    "url": "https://trello.com",
    "description": "Kanban-style boards for lightweight project coordination.",
    "logo": "https://www.google.com/s2/favicons?domain=trello.com&sz=128",
    "section": "COLLABORATION",
    "tags": ["kanban", "boards", "tasks"]
  },
  {
    "id": "zendesk",
    "name": "Zendesk",
    "url": "https://www.zendesk.com",
    "description": "Support operations, ticketing, and help center workflows.",
    "logo": "https://www.google.com/s2/favicons?domain=zendesk.com&sz=128",
    "section": "COLLABORATION",
    "tags": ["support", "tickets", "customers"]
  },
  {
    "id": "intercom",
    "name": "Intercom",
    "url": "https://www.intercom.com",
    "description": "Customer messaging, onboarding, and support automation.",
    "logo": "https://www.google.com/s2/favicons?domain=intercom.com&sz=128",
    "section": "COLLABORATION",
    "tags": ["support", "messaging", "customer-success"]
  },
  {
    "id": "grafana",
    "name": "Grafana",
    "url": "https://grafana.com",
    "description": "Dashboards for metrics, logs, traces, and alerting.",
    "logo": "https://www.google.com/s2/favicons?domain=grafana.com&sz=128",
    "section": "TELEMETRY",
    "tags": ["metrics", "dashboards", "observability"]
  },
  {
    "id": "datadog",
    "name": "Datadog",
    "url": "https://app.datadoghq.com",
    "description": "Unified infrastructure, APM, logs, and cloud monitoring.",
    "logo": "https://www.google.com/s2/favicons?domain=datadoghq.com&sz=128",
    "section": "TELEMETRY",
    "tags": ["apm", "logs", "monitoring"]
  },
  {
    "id": "new-relic",
    "name": "New Relic",
    "url": "https://newrelic.com",
    "description": "Full-stack observability with telemetry and incident context.",
    "logo": "https://www.google.com/s2/favicons?domain=newrelic.com&sz=128",
    "section": "TELEMETRY",
    "tags": ["apm", "telemetry", "full-stack"]
  },
  {
    "id": "sentry",
    "name": "Sentry",
    "url": "https://sentry.io",
    "description": "Error tracking, performance monitoring, and release health.",
    "logo": "https://www.google.com/s2/favicons?domain=sentry.io&sz=128",
    "section": "TELEMETRY",
    "tags": ["errors", "performance", "releases"]
  },
  {
    "id": "splunk",
    "name": "Splunk",
    "url": "https://www.splunk.com",
    "description": "Operational analytics for logs, events, and security data.",
    "logo": "https://www.google.com/s2/favicons?domain=splunk.com&sz=128",
    "section": "TELEMETRY",
    "tags": ["logs", "analytics", "events"]
  },
  {
    "id": "elastic",
    "name": "Elastic",
    "url": "https://www.elastic.co",
    "description": "Search, logs, security analytics, and observability tooling.",
    "logo": "https://www.google.com/s2/favicons?domain=elastic.co&sz=128",
    "section": "TELEMETRY",
    "tags": ["search", "logs", "observability"]
  },
  {
    "id": "honeycomb",
    "name": "Honeycomb",
    "url": "https://www.honeycomb.io",
    "description": "High-cardinality observability for debugging complex systems.",
    "logo": "https://www.google.com/s2/favicons?domain=honeycomb.io&sz=128",
    "section": "TELEMETRY",
    "tags": ["tracing", "debugging", "observability"]
  },
  {
    "id": "amplitude",
    "name": "Amplitude",
    "url": "https://amplitude.com",
    "description": "Product analytics for funnels, retention, and experimentation.",
    "logo": "https://www.google.com/s2/favicons?domain=amplitude.com&sz=128",
    "section": "TELEMETRY",
    "tags": ["product-analytics", "funnels", "retention"]
  },
  {
    "id": "mixpanel",
    "name": "Mixpanel",
    "url": "https://mixpanel.com",
    "description": "Event analytics for product usage and growth teams.",
    "logo": "https://www.google.com/s2/favicons?domain=mixpanel.com&sz=128",
    "section": "TELEMETRY",
    "tags": ["events", "analytics", "growth"]
  },
  {
    "id": "pagerduty",
    "name": "PagerDuty",
    "url": "https://www.pagerduty.com",
    "description": "On-call management and incident response automation.",
    "logo": "https://www.google.com/s2/favicons?domain=pagerduty.com&sz=128",
    "section": "TELEMETRY",
    "tags": ["incidents", "on-call", "alerts"]
  },
  {
    "id": "okta",
    "name": "Okta",
    "url": "https://www.okta.com",
    "description": "Identity, SSO, and access management for workforce apps.",
    "logo": "https://www.google.com/s2/favicons?domain=okta.com&sz=128",
    "section": "SECURITY",
    "tags": ["identity", "sso", "access"]
  },
  {
    "id": "auth0",
    "name": "Auth0",